<?xml version="1.0" encoding="UTF-8"?>
<xs:schema xmlns:xs="http://www.w3.org/2001/XMLSchema"
    targetNamespace="http://www.example.com/company"
    elementFormDefault="qualified"><!--This
    ensures that all elements within the XSD are namespace-qualified, which aligns with the XML
    document.-->
    <!-- Root element -->
    <xs:element name="Company">
        <xs:complexType>
            <xs:sequence>
                <xs:element name="Name" type="xs:string" />
                <xs:element name="Departments">
                    <xs:complexType>
                        <xs:sequence>
                            <xs:element name="Department" maxOccurs="unbounded">
                                <xs:complexType>
                                    <xs:sequence>
                                        <xs:element name="Name" type="xs:string" />
                                        <xs:element name="Employees">
                                            <xs:complexType>
                                                <xs:sequence>
                                                    <xs:element name="Employee"
                                                        maxOccurs="unbounded">
                                                        <xs:complexType>
                                                            <xs:sequence>
                                                                <xs:element name="Name"
                                                                    type="xs:string" />
                                                                <xs:element name="Position"
                                                                    type="xs:string" />
                                                            </xs:sequence>
                                                        </xs:complexType>
                                                    </xs:element>
                                                </xs:sequence>
                                            </xs:complexType>
                                        </xs:element>
                                    </xs:sequence>
                                </xs:complexType>
                            </xs:element>
                        </xs:sequence>
                    </xs:complexType>
                </xs:element>
            </xs:sequence>
        </xs:complexType>
    </xs:element>

</xs:schema>